Enter password: ****
Welcome to the MySQL monitor.  Commands end with ; or \g.
Your MySQL connection id is 10
Server version: 8.0.45 MySQL Community Server - GPL

Copyright (c) 2000, 2026, Oracle and/or its affiliates.

Oracle is a registered trademark of Oracle Corporation and/or its
affiliates. Other names may be trademarks of their respective
owners.

Type 'help;' or '\h' for help. Type '\c' to clear the current input statement.

mysql> show databases;
+--------------------+
| Database           |
+--------------------+
| amitdb             |
| information_schema |
| mysql              |
| performance_schema |
| sys                |
+--------------------+
5 rows in set (0.05 sec)

mysql> create database employee;
Query OK, 1 row affected (0.03 sec)

mysql> show databases;
+--------------------+
| Database           |
+--------------------+
| amitdb             |
| employee           |
| information_schema |
| mysql              |
| performance_schema |
| sys                |
+--------------------+
6 rows in set (0.00 sec)

mysql> use employee;
Database changed
mysql> show tables;
Empty set (0.03 sec)

mysql> create table emp(empId int primary key, name varchar(20), city varchar(30), mobNo varchar(10) not null, adhar varchar(12) not null);
Query OK, 0 rows affected (0.08 sec)

mysql> desc emp;
+-------+-------------+------+-----+---------+-------+
| Field | Type        | Null | Key | Default | Extra |
+-------+-------------+------+-----+---------+-------+
| empId | int         | NO   | PRI | NULL    |       |
| name  | varchar(20) | YES  |     | NULL    |       |
| city  | varchar(30) | YES  |     | NULL    |       |
| mobNo | varchar(10) | NO   |     | NULL    |       |
| adhar | varchar(12) | NO   |     | NULL    |       |
+-------+-------------+------+-----+---------+-------+
5 rows in set (0.03 sec)

mysql> insert into emp(empId, name, city, mobNo, adhar) values(1, 'Amit', 'PCMC', '1234567890','123456789012');
Query OK, 1 row affected (0.05 sec)

mysql> insert into emp(empId, name, city, mobNo, adhar) values(2, 'Ram', 'Pune', '2334567890','654456789012'),(3, 'Krishna', 'Mumbai', '3234567890','623456789012'),(4, 'Shyam', 'Rajastan', '8234567890','023456789012'),(5, 'Radha', 'Vrindawan', '9234567890','223456789012');
Query OK, 4 rows affected (0.03 sec)
Records: 4  Duplicates: 0  Warnings: 0

mysql> select * from emp;
+-------+---------+-----------+------------+--------------+
| empId | name    | city      | mobNo      | adhar        |
+-------+---------+-----------+------------+--------------+
|     1 | Amit    | PCMC      | 1234567890 | 123456789012 |
|     2 | Ram     | Pune      | 2334567890 | 654456789012 |
|     3 | Krishna | Mumbai    | 3234567890 | 623456789012 |
|     4 | Shyam   | Rajastan  | 8234567890 | 023456789012 |
|     5 | Radha   | Vrindawan | 9234567890 | 223456789012 |
+-------+---------+-----------+------------+--------------+
5 rows in set (0.00 sec)

mysql> update emp set name = 'Shiva' where empId = 4;
Query OK, 1 row affected (0.03 sec)
Rows matched: 1  Changed: 1  Warnings: 0

mysql> select * from emp;
+-------+---------+-----------+------------+--------------+
| empId | name    | city      | mobNo      | adhar        |
+-------+---------+-----------+------------+--------------+
|     1 | Amit    | PCMC      | 1234567890 | 123456789012 |
|     2 | Ram     | Pune      | 2334567890 | 654456789012 |
|     3 | Krishna | Mumbai    | 3234567890 | 623456789012 |
|     4 | Shiva   | Rajastan  | 8234567890 | 023456789012 |
|     5 | Radha   | Vrindawan | 9234567890 | 223456789012 |
+-------+---------+-----------+------------+--------------+
5 rows in set (0.00 sec)

mysql> insert into emp(empId, name, city, mobNo, adhar) values(6, 'Ajay', 'Nashik', '4234567890','122456789012');
Query OK, 1 row affected (0.03 sec)

mysql> select * from emp;
+-------+---------+-----------+------------+--------------+
| empId | name    | city      | mobNo      | adhar        |
+-------+---------+-----------+------------+--------------+
|     1 | Amit    | PCMC      | 1234567890 | 123456789012 |
|     2 | Ram     | Pune      | 2334567890 | 654456789012 |
|     3 | Krishna | Mumbai    | 3234567890 | 623456789012 |
|     4 | Shiva   | Rajastan  | 8234567890 | 023456789012 |
|     5 | Radha   | Vrindawan | 9234567890 | 223456789012 |
|     6 | Ajay    | Nashik    | 4234567890 | 122456789012 |
+-------+---------+-----------+------------+--------------+
6 rows in set (0.00 sec)

mysql> delete from emp where empId = 6;
Query OK, 1 row affected (0.03 sec)

mysql> select * from emp;
+-------+---------+-----------+------------+--------------+
| empId | name    | city      | mobNo      | adhar        |
+-------+---------+-----------+------------+--------------+
|     1 | Amit    | PCMC      | 1234567890 | 123456789012 |
|     2 | Ram     | Pune      | 2334567890 | 654456789012 |
|     3 | Krishna | Mumbai    | 3234567890 | 623456789012 |
|     4 | Shiva   | Rajastan  | 8234567890 | 023456789012 |
|     5 | Radha   | Vrindawan | 9234567890 | 223456789012 |
+-------+---------+-----------+------------+--------------+
5 rows in set (0.00 sec)

mysql> select * from emp where name = 'Krishna' AND city = 'Vrindawan';
Empty set (0.00 sec)

mysql> select * from emp where name = 'Krishna' OR city = 'Vrindawan';
+-------+---------+-----------+------------+--------------+
| empId | name    | city      | mobNo      | adhar        |
+-------+---------+-----------+------------+--------------+
|     3 | Krishna | Mumbai    | 3234567890 | 623456789012 |
|     5 | Radha   | Vrindawan | 9234567890 | 223456789012 |
+-------+---------+-----------+------------+--------------+
2 rows in set (0.00 sec)

mysql> select * from emp where name = 'Krishna' AND city = 'MUMBAI';
+-------+---------+--------+------------+--------------+
| empId | name    | city   | mobNo      | adhar        |
+-------+---------+--------+------------+--------------+
|     3 | Krishna | Mumbai | 3234567890 | 623456789012 |
+-------+---------+--------+------------+--------------+
1 row in set (0.00 sec)

mysql>